{
  "schemaVersion": "1.0.0",
  "catalogId": "st-score-restore-initial-fixture-plan.v1",
  "description": "Metadata-only plan covering every approved input, notation, and degradation category. No document bytes are included.",
  "fixtures": [
    {
      "fixtureId": "fixture.digital-pdf.clean-staff.v1",
      "title": "Clean digital PDF staff baseline",
      "input": {"kind": "digital_pdf", "mediaType": "application/pdf", "notationKinds": ["staff"], "pageCount": 1},
      "degradations": ["none"],
      "artifact": {"state": "metadata_only", "relativePath": null, "sha256": null, "byteSize": null},
      "provenance": {"sourceKind": "public_domain", "sourceReference": "Planned public-domain source; exact file requires review.", "rightsHolder": "Public domain", "licenseId": "Public-Domain-1.0", "usageBasis": "Metadata planning only."},
      "privacy": {"containsPersonalData": false, "containsStudentData": false, "deidentified": true, "privacyReviewStatus": "not_required"},
      "consent": {"teacherApproval": false, "trainingConsent": "not_applicable", "consentReference": null},
      "permittedUses": {"testing": false, "training": false, "publication": false, "demonstration": false},
      "retention": {"policy": "metadata_only", "expiresOn": null, "storageLocation": "Git metadata only"},
      "annotations": {"regressionId": "regression.clean-digital-staff.v1", "riskTargets": ["staff_lines", "noteheads", "augmentation_dots", "accidentals"], "expectedInvariantNotes": ["Keep vector content vector.", "Preserve five staff lines and small notation marks."]},
      "syntheticGeneration": null,
      "review": {"status": "planned", "reviewedBy": null, "reviewedOn": null, "notes": "No artifact selected."}
    },
    {
      "fixtureId": "fixture.scanned-pdf.skew-shadow-noise.v1",
      "title": "Scanned PDF with skew, shadow, and noise",
      "input": {"kind": "scanned_pdf", "mediaType": "application/pdf", "notationKinds": ["combined_staff_tab"], "pageCount": 1},
      "degradations": ["skew", "shadow", "noise"],
      "artifact": {"state": "planned", "relativePath": null, "sha256": null, "byteSize": null},
      "provenance": {"sourceKind": "synthetic", "sourceReference": "Planned derivation from the clean PDF baseline.", "rightsHolder": "ST Score Restore project", "licenseId": "Project-Synthetic-1.0", "usageBasis": "Synthetic planning only."},
      "privacy": {"containsPersonalData": false, "containsStudentData": false, "deidentified": true, "privacyReviewStatus": "not_required"},
      "consent": {"teacherApproval": false, "trainingConsent": "not_applicable", "consentReference": null},
      "permittedUses": {"testing": false, "training": false, "publication": false, "demonstration": false},
      "retention": {"policy": "metadata_only", "expiresOn": null, "storageLocation": "Git metadata only"},
      "annotations": {"regressionId": "regression.scanned-skew-shadow-noise.v1", "riskTargets": ["staff_lines", "tab_lines", "beams", "augmentation_dots", "tab_numbers"], "expectedInvariantNotes": ["Deskew preserves staff/TAB geometry.", "Cleanup does not erase dots, beams, or TAB digits."]},
      "syntheticGeneration": {"derivedFromFixtureId": "fixture.digital-pdf.clean-staff.v1", "generator": "st-synthetic-degradation-plan", "generatorVersion": "1.0.0", "seed": 101, "parameters": {"skewDegrees": 3, "shadowStrength": 0.35, "noiseSigma": 7}, "cleanSourceApproved": true},
      "review": {"status": "planned", "reviewedBy": null, "reviewedOn": null, "notes": "Generation disabled until source and generator approval."}
    },
    {
      "fixtureId": "fixture.hybrid-pdf.compression.v1",
      "title": "Hybrid PDF with compression artifacts",
      "input": {"kind": "hybrid_pdf", "mediaType": "application/pdf", "notationKinds": ["combined_staff_tab"], "pageCount": 2},
      "degradations": ["compression"],
      "artifact": {"state": "planned", "relativePath": null, "sha256": null, "byteSize": null},
      "provenance": {"sourceKind": "synthetic", "sourceReference": "Planned vector plus compressed-raster hybrid.", "rightsHolder": "ST Score Restore project", "licenseId": "Project-Synthetic-1.0", "usageBasis": "Synthetic planning only."},
      "privacy": {"containsPersonalData": false, "containsStudentData": false, "deidentified": true, "privacyReviewStatus": "not_required"},
      "consent": {"teacherApproval": false, "trainingConsent": "not_applicable", "consentReference": null},
      "permittedUses": {"testing": false, "training": false, "publication": false, "demonstration": false},
      "retention": {"policy": "metadata_only", "expiresOn": null, "storageLocation": "Git metadata only"},
      "annotations": {"regressionId": "regression.hybrid-compression.v1", "riskTargets": ["staff_lines", "tab_lines", "barlines", "tab_numbers"], "expectedInvariantNotes": ["Do not rasterize the clean vector page.", "Compression cleanup does not reinterpret TAB numbers."]},
      "syntheticGeneration": {"derivedFromFixtureId": "fixture.digital-pdf.clean-staff.v1", "generator": "st-synthetic-degradation-plan", "generatorVersion": "1.0.0", "seed": 202, "parameters": {"jpegQuality": 40}, "cleanSourceApproved": true},
      "review": {"status": "planned", "reviewedBy": null, "reviewedOn": null, "notes": "Hybrid construction not implemented."}
    },
    {
      "fixtureId": "fixture.jpg.low-resolution-tab.v1",
      "title": "Low-resolution compressed JPG guitar TAB",
      "input": {"kind": "jpg", "mediaType": "image/jpeg", "notationKinds": ["guitar_tab"], "pageCount": 1},
      "degradations": ["low_resolution", "compression"],
      "artifact": {"state": "planned", "relativePath": null, "sha256": null, "byteSize": null},
      "provenance": {"sourceKind": "synthetic", "sourceReference": "Planned JPG export from an approved clean TAB source.", "rightsHolder": "ST Score Restore project", "licenseId": "Project-Synthetic-1.0", "usageBasis": "Synthetic planning only."},
      "privacy": {"containsPersonalData": false, "containsStudentData": false, "deidentified": true, "privacyReviewStatus": "not_required"},
      "consent": {"teacherApproval": false, "trainingConsent": "not_applicable", "consentReference": null},
      "permittedUses": {"testing": false, "training": false, "publication": false, "demonstration": false},
      "retention": {"policy": "metadata_only", "expiresOn": null, "storageLocation": "Git metadata only"},
      "annotations": {"regressionId": "regression.jpg-low-resolution-tab.v1", "riskTargets": ["tab_lines", "tab_numbers", "guitar_articulations"], "expectedInvariantNotes": ["Keep all six TAB lines.", "Do not invent or alter fret digits."]},
      "syntheticGeneration": {"derivedFromFixtureId": "fixture.digital-pdf.clean-staff.v1", "generator": "st-synthetic-degradation-plan", "generatorVersion": "1.0.0", "seed": 303, "parameters": {"targetDpi": 90, "jpegQuality": 32}, "cleanSourceApproved": true},
      "review": {"status": "planned", "reviewedBy": null, "reviewedOn": null, "notes": "A dedicated clean TAB origin is still required."}
    },
    {
      "fixtureId": "fixture.jpeg.blur-staff.v1",
      "title": "Blurred JPEG staff notation",
      "input": {"kind": "jpeg", "mediaType": "image/jpeg", "notationKinds": ["staff"], "pageCount": 1},
      "degradations": ["blur"],
      "artifact": {"state": "planned", "relativePath": null, "sha256": null, "byteSize": null},
      "provenance": {"sourceKind": "synthetic", "sourceReference": "Planned deterministic motion-blur derivative.", "rightsHolder": "ST Score Restore project", "licenseId": "Project-Synthetic-1.0", "usageBasis": "Synthetic planning only."},
      "privacy": {"containsPersonalData": false, "containsStudentData": false, "deidentified": true, "privacyReviewStatus": "not_required"},
      "consent": {"teacherApproval": false, "trainingConsent": "not_applicable", "consentReference": null},
      "permittedUses": {"testing": false, "training": false, "publication": false, "demonstration": false},
      "retention": {"policy": "metadata_only", "expiresOn": null, "storageLocation": "Git metadata only"},
      "annotations": {"regressionId": "regression.jpeg-blur-staff.v1", "riskTargets": ["noteheads", "stems", "flags", "accidentals"], "expectedInvariantNotes": ["Deblurring does not split or merge noteheads.", "Do not invent flag or accidental edges."]},
      "syntheticGeneration": {"derivedFromFixtureId": "fixture.digital-pdf.clean-staff.v1", "generator": "st-synthetic-degradation-plan", "generatorVersion": "1.0.0", "seed": 404, "parameters": {"motionLengthPixels": 7, "motionAngleDegrees": 12}, "cleanSourceApproved": true},
      "review": {"status": "planned", "reviewedBy": null, "reviewedOn": null, "notes": "Thresholds are not approved."}
    },
    {
      "fixtureId": "fixture.png.uneven-lighting-combined.v1",
      "title": "PNG with uneven lighting",
      "input": {"kind": "png", "mediaType": "image/png", "notationKinds": ["combined_staff_tab"], "pageCount": 1},
      "degradations": ["uneven_lighting"],
      "artifact": {"state": "planned", "relativePath": null, "sha256": null, "byteSize": null},
      "provenance": {"sourceKind": "synthetic", "sourceReference": "Planned lossless PNG with deterministic light gradient.", "rightsHolder": "ST Score Restore project", "licenseId": "Project-Synthetic-1.0", "usageBasis": "Synthetic planning only."},
      "privacy": {"containsPersonalData": false, "containsStudentData": false, "deidentified": true, "privacyReviewStatus": "not_required"},
      "consent": {"teacherApproval": false, "trainingConsent": "not_applicable", "consentReference": null},
      "permittedUses": {"testing": false, "training": false, "publication": false, "demonstration": false},
      "retention": {"policy": "metadata_only", "expiresOn": null, "storageLocation": "Git metadata only"},